<?xml version="1.0" encoding="UTF-8"?>
<!ELEMENT chat (message*)>
<!ATTLIST chat
	evenementId CDATA #REQUIRED
>
<!ELEMENT message (date,auteur,auteurId,texte)>
<!ATTLIST message
	idUtilisateur CDATA #REQUIRED
	idEvenement CDATA #REQUIRED
>
<!ELEMENT date (#PCDATA)>
<!ELEMENT auteur (#PCDATA)>
<!ELEMENT auteurId (#PCDATA)>
<!ELEMENT texte (#PCDATA)>